{"schema_version":"v0alpha1","plan_id":"1111111111111111111111111111111111111111111111111111111111111111","created_from":{"report_digest":"report-incomplete","source_scan_id":"scan-incomplete","scanner":"osv-scanner","repository_state":"tree-incomplete"},"repository_identity":{"root":".","repository":"example"},"workspace_identity":{"id":"service","path":"."},"finding_identity":{"stable_key":"finding-incomplete","current_version":"1.0.0"},"component":{"purl":"pkg:npm/example@1.0.0","name":"example","version":"1.0.0"},"current_state":{"direct":true,"vulnerable":true},"candidates":[{"id":"candidate-unavailable","version":"1.1.0","state":"unavailable","evidence":{"constraint_satisfied":false,"lockfile_resolution":false,"peer_compatible":false,"runtime_compatible":false,"engine_compatible":false,"unknown":["package metadata"]},"direct":true,"major_change":false}],"recommendation":null,"affected_files":[],"commands":[],"risks":[],"assumptions":[{"code":"analysis_incomplete"}],"verification":[],"rollback":{},"provenance":{"artifact_digests":[],"sources":["scan.json"]}}