{"schema_version":"v0alpha1","plan_id":"cccccccccccccccccccccccccccccccccccccccccccccccccccccccccccccccc","created_from":{"report_digest":"report-3","source_scan_id":"scan-3","scanner":"osv-scanner","repository_state":"tree-3"},"repository_identity":{"root":".","repository":"example"},"workspace_identity":{"id":"worker","path":"."},"finding_identity":{"stable_key":"finding-3","current_version":"3.0.0"},"component":{"purl":"pkg:maven/org.example/app@3.0.0","name":"org.example:app","version":"3.0.0"},"current_state":{"direct":false,"vulnerable":true},"candidates":[{"id":"candidate-unknown","version":"3.1.0","state":"unknown","evidence":{"constraint_satisfied":false,"lockfile_resolution":false,"peer_compatible":false,"runtime_compatible":false,"engine_compatible":false,"unknown":["metadata"]},"direct":false,"major_change":false}],"recommendation":null,"affected_files":[],"commands":[],"risks":[{"code":"metadata_missing","severity":"high","detected":true}],"assumptions":[],"verification":[],"rollback":{},"provenance":{"artifact_digests":[],"sources":["scan.json"]}}