{"schema_version":"v0alpha1","plan_id":"ffffffffffffffffffffffffffffffffffffffffffffffffffffffffffffffff","created_from":{"report_digest":"stale-report","source_scan_id":"scan-old","scanner":"osv-scanner","repository_state":"old-tree"},"repository_identity":{"root":".","repository":"example","revision":"old-rev"},"workspace_identity":{"id":"service","path":"."},"finding_identity":{"stable_key":"finding-stale","current_version":"1.0.0"},"component":{"purl":"pkg:npm/example@1.0.0","name":"example","version":"1.0.0"},"current_state":{"direct":true,"vulnerable":true},"candidates":[],"recommendation":null,"affected_files":[],"commands":[],"risks":[{"code":"stale_input","severity":"high","detected":true}],"assumptions":[],"verification":[],"rollback":{},"provenance":{"artifact_digests":["old-artifact"],"sources":["old-scan.json"]}}